{"abi":[{"type":"error","name":"ERC1155InsufficientBalance","inputs":[{"name":"sender","type":"address","internalType":"address"},{"name":"balance","type":"uint256","internalType":"uint256"},{"name":"needed","type":"uint256","internalType":"uint256"},{"name":"tokenId","type":"uint256","internalType":"uint256"}]},{"type":"error","name":"ERC1155InvalidApprover","inputs":[{"name":"approver","type":"address","internalType":"address"}]},{"type":"error","name":"ERC1155InvalidArrayLength","inputs":[{"name":"idsLength","type":"uint256","internalType":"uint256"},{"name":"valuesLength","type":"uint256","internalType":"uint256"}]},{"type":"error","name":"ERC1155InvalidOperator","inputs":[{"name":"operator","type":"address","internalType":"address"}]},{"type":"error","name":"ERC1155InvalidReceiver","inputs":[{"name":"receiver","type":"address","internalType":"address"}]},{"type":"error","name":"ERC1155InvalidSender","inputs":[{"name":"sender","type":"address","internalType":"address"}]},{"type":"error","name":"ERC1155MissingApprovalForAll","inputs":[{"name":"operator","type":"address","internalType":"address"},{"name":"owner","type":"address","internalType":"address"}]}],"bytecode":{"object":"0x","sourceMap":"","linkReferences":{}},"deployedBytecode":{"object":"0x","sourceMap":"","linkReferences":{}},"methodIdentifiers":{},"rawMetadata":"{\"compiler\":{\"version\":\"0.8.30+commit.73712a01\"},\"language\":\"Solidity\",\"output\":{\"abi\":[{\"inputs\":[{\"internalType\":\"address\",\"name\":\"sender\",\"type\":\"address\"},{\"internalType\":\"uint256\",\"name\":\"balance\",\"type\":\"uint256\"},{\"internalType\":\"uint256\",\"name\":\"needed\",\"type\":\"uint256\"},{\"internalType\":\"uint256\",\"name\":\"tokenId\",\"type\":\"uint256\"}],\"name\":\"ERC1155InsufficientBalance\",\"type\":\"error\"},{\"inputs\":[{\"internalType\":\"address\",\"name\":\"approver\",\"type\":\"address\"}],\"name\":\"ERC1155InvalidApprover\",\"type\":\"error\"},{\"inputs\":[{\"internalType\":\"uint256\",\"name\":\"idsLength\",\"type\":\"uint256\"},{\"internalType\":\"uint256\",\"name\":\"valuesLength\",\"type\":\"uint256\"}],\"name\":\"ERC1155InvalidArrayLength\",\"type\":\"error\"},{\"inputs\":[{\"internalType\":\"address\",\"name\":\"operator\",\"type\":\"address\"}],\"name\":\"ERC1155InvalidOperator\",\"type\":\"error\"},{\"inputs\":[{\"internalType\":\"address\",\"name\":\"receiver\",\"type\":\"address\"}],\"name\":\"ERC1155InvalidReceiver\",\"type\":\"error\"},{\"inputs\":[{\"internalType\":\"address\",\"name\":\"sender\",\"type\":\"address\"}],\"name\":\"ERC1155InvalidSender\",\"type\":\"error\"},{\"inputs\":[{\"internalType\":\"address\",\"name\":\"operator\",\"type\":\"address\"},{\"internalType\":\"address\",\"name\":\"owner\",\"type\":\"address\"}],\"name\":\"ERC1155MissingApprovalForAll\",\"type\":\"error\"}],\"devdoc\":{\"details\":\"Standard ERC-1155 Errors Interface of the https://eips.ethereum.org/EIPS/eip-6093[ERC-6093] custom errors for ERC-1155 tokens.\",\"errors\":{\"ERC1155InsufficientBalance(address,uint256,uint256,uint256)\":[{\"details\":\"Indicates an error related to the current `balance` of a `sender`. Used in transfers.\",\"params\":{\"balance\":\"Current balance for the interacting account.\",\"needed\":\"Minimum amount required to perform a transfer.\",\"sender\":\"Address whose tokens are being transferred.\",\"tokenId\":\"Identifier number of a token.\"}}],\"ERC1155InvalidApprover(address)\":[{\"details\":\"Indicates a failure with the `approver` of a token to be approved. Used in approvals.\",\"params\":{\"approver\":\"Address initiating an approval operation.\"}}],\"ERC1155InvalidArrayLength(uint256,uint256)\":[{\"details\":\"Indicates an array length mismatch between ids and values in a safeBatchTransferFrom operation. Used in batch transfers.\",\"params\":{\"idsLength\":\"Length of the array of token identifiers\",\"valuesLength\":\"Length of the array of token amounts\"}}],\"ERC1155InvalidOperator(address)\":[{\"details\":\"Indicates a failure with the `operator` to be approved. Used in approvals.\",\"params\":{\"operator\":\"Address that may be allowed to operate on tokens without being their owner.\"}}],\"ERC1155InvalidReceiver(address)\":[{\"details\":\"Indicates a failure with the token `receiver`. Used in transfers.\",\"params\":{\"receiver\":\"Address to which tokens are being transferred.\"}}],\"ERC1155InvalidSender(address)\":[{\"details\":\"Indicates a failure with the token `sender`. Used in transfers.\",\"params\":{\"sender\":\"Address whose tokens are being transferred.\"}}],\"ERC1155MissingApprovalForAll(address,address)\":[{\"details\":\"Indicates a failure with the `operator`\\u2019s approval. Used in transfers.\",\"params\":{\"operator\":\"Address that may be allowed to operate on tokens without being their owner.\",\"owner\":\"Address of the current owner of a token.\"}}]},\"kind\":\"dev\",\"methods\":{},\"version\":1},\"userdoc\":{\"kind\":\"user\",\"methods\":{},\"version\":1}},\"settings\":{\"compilationTarget\":{\"lib/openzeppelin-contracts/contracts/interfaces/draft-IERC6093.sol\":\"IERC1155Errors\"},\"evmVersion\":\"prague\",\"libraries\":{},\"metadata\":{\"bytecodeHash\":\"ipfs\",\"useLiteralContent\":true},\"optimizer\":{\"enabled\":false,\"runs\":200},\"remappings\":[\":@openzeppelin/contracts/=lib/openzeppelin-contracts/contracts/\",\":ds-test/=lib/openzeppelin-contracts/lib/forge-std/lib/ds-test/src/\",\":erc4626-tests/=lib/openzeppelin-contracts/lib/erc4626-tests/\",\":forge-std/=lib/forge-std/src/\",\":halmos-cheatcodes/=lib/openzeppelin-contracts/lib/halmos-cheatcodes/src/\",\":openzeppelin-contracts/=lib/openzeppelin-contracts/\"]},\"sources\":{\"lib/openzeppelin-contracts/contracts/interfaces/draft-IERC6093.sol\":{\"content\":\"// SPDX-License-Identifier: MIT\\n// OpenZeppelin Contracts (last updated v5.1.0) (interfaces/draft-IERC6093.sol)\\npragma solidity ^0.8.20;\\n\\n/**\\n * @dev Standard ERC-20 Errors\\n * Interface of the https://eips.ethereum.org/EIPS/eip-6093[ERC-6093] custom errors for ERC-20 tokens.\\n */\\ninterface IERC20Errors {\\n    /**\\n     * @dev Indicates an error related to the current `balance` of a `sender`. Used in transfers.\\n     * @param sender Address whose tokens are being transferred.\\n     * @param balance Current balance for the interacting account.\\n     * @param needed Minimum amount required to perform a transfer.\\n     */\\n    error ERC20InsufficientBalance(address sender, uint256 balance, uint256 needed);\\n\\n    /**\\n     * @dev Indicates a failure with the token `sender`. Used in transfers.\\n     * @param sender Address whose tokens are being transferred.\\n     */\\n    error ERC20InvalidSender(address sender);\\n\\n    /**\\n     * @dev Indicates a failure with the token `receiver`. Used in transfers.\\n     * @param receiver Address to which tokens are being transferred.\\n     */\\n    error ERC20InvalidReceiver(address receiver);\\n\\n    /**\\n     * @dev Indicates a failure with the `spender`\\u2019s `allowance`. Used in transfers.\\n     * @param spender Address that may be allowed to operate on tokens without being their owner.\\n     * @param allowance Amount of tokens a `spender` is allowed to operate with.\\n     * @param needed Minimum amount required to perform a transfer.\\n     */\\n    error ERC20InsufficientAllowance(address spender, uint256 allowance, uint256 needed);\\n\\n    /**\\n     * @dev Indicates a failure with the `approver` of a token to be approved. Used in approvals.\\n     * @param approver Address initiating an approval operation.\\n     */\\n    error ERC20InvalidApprover(address approver);\\n\\n    /**\\n     * @dev Indicates a failure with the `spender` to be approved. Used in approvals.\\n     * @param spender Address that may be allowed to operate on tokens without being their owner.\\n     */\\n    error ERC20InvalidSpender(address spender);\\n}\\n\\n/**\\n * @dev Standard ERC-721 Errors\\n * Interface of the https://eips.ethereum.org/EIPS/eip-6093[ERC-6093] custom errors for ERC-721 tokens.\\n */\\ninterface IERC721Errors {\\n    /**\\n     * @dev Indicates that an address can't be an owner. For example, `address(0)` is a forbidden owner in ERC-20.\\n     * Used in balance queries.\\n     * @param owner Address of the current owner of a token.\\n     */\\n    error ERC721InvalidOwner(address owner);\\n\\n    /**\\n     * @dev Indicates a `tokenId` whose `owner` is the zero address.\\n     * @param tokenId Identifier number of a token.\\n     */\\n    error ERC721NonexistentToken(uint256 tokenId);\\n\\n    /**\\n     * @dev Indicates an error related to the ownership over a particular token. Used in transfers.\\n     * @param sender Address whose tokens are being transferred.\\n     * @param tokenId Identifier number of a token.\\n     * @param owner Address of the current owner of a token.\\n     */\\n    error ERC721IncorrectOwner(address sender, uint256 tokenId, address owner);\\n\\n    /**\\n     * @dev Indicates a failure with the token `sender`. Used in transfers.\\n     * @param sender Address whose tokens are being transferred.\\n     */\\n    error ERC721InvalidSender(address sender);\\n\\n    /**\\n     * @dev Indicates a failure with the token `receiver`. Used in transfers.\\n     * @param receiver Address to which tokens are being transferred.\\n     */\\n    error ERC721InvalidReceiver(address receiver);\\n\\n    /**\\n     * @dev Indicates a failure with the `operator`\\u2019s approval. Used in transfers.\\n     * @param operator Address that may be allowed to operate on tokens without being their owner.\\n     * @param tokenId Identifier number of a token.\\n     */\\n    error ERC721InsufficientApproval(address operator, uint256 tokenId);\\n\\n    /**\\n     * @dev Indicates a failure with the `approver` of a token to be approved. Used in approvals.\\n     * @param approver Address initiating an approval operation.\\n     */\\n    error ERC721InvalidApprover(address approver);\\n\\n    /**\\n     * @dev Indicates a failure with the `operator` to be approved. Used in approvals.\\n     * @param operator Address that may be allowed to operate on tokens without being their owner.\\n     */\\n    error ERC721InvalidOperator(address operator);\\n}\\n\\n/**\\n * @dev Standard ERC-1155 Errors\\n * Interface of the https://eips.ethereum.org/EIPS/eip-6093[ERC-6093] custom errors for ERC-1155 tokens.\\n */\\ninterface IERC1155Errors {\\n    /**\\n     * @dev Indicates an error related to the current `balance` of a `sender`. Used in transfers.\\n     * @param sender Address whose tokens are being transferred.\\n     * @param balance Current balance for the interacting account.\\n     * @param needed Minimum amount required to perform a transfer.\\n     * @param tokenId Identifier number of a token.\\n     */\\n    error ERC1155InsufficientBalance(address sender, uint256 balance, uint256 needed, uint256 tokenId);\\n\\n    /**\\n     * @dev Indicates a failure with the token `sender`. Used in transfers.\\n     * @param sender Address whose tokens are being transferred.\\n     */\\n    error ERC1155InvalidSender(address sender);\\n\\n    /**\\n     * @dev Indicates a failure with the token `receiver`. Used in transfers.\\n     * @param receiver Address to which tokens are being transferred.\\n     */\\n    error ERC1155InvalidReceiver(address receiver);\\n\\n    /**\\n     * @dev Indicates a failure with the `operator`\\u2019s approval. Used in transfers.\\n     * @param operator Address that may be allowed to operate on tokens without being their owner.\\n     * @param owner Address of the current owner of a token.\\n     */\\n    error ERC1155MissingApprovalForAll(address operator, address owner);\\n\\n    /**\\n     * @dev Indicates a failure with the `approver` of a token to be approved. Used in approvals.\\n     * @param approver Address initiating an approval operation.\\n     */\\n    error ERC1155InvalidApprover(address approver);\\n\\n    /**\\n     * @dev Indicates a failure with the `operator` to be approved. Used in approvals.\\n     * @param operator Address that may be allowed to operate on tokens without being their owner.\\n     */\\n    error ERC1155InvalidOperator(address operator);\\n\\n    /**\\n     * @dev Indicates an array length mismatch between ids and values in a safeBatchTransferFrom operation.\\n     * Used in batch transfers.\\n     * @param idsLength Length of the array of token identifiers\\n     * @param valuesLength Length of the array of token amounts\\n     */\\n    error ERC1155InvalidArrayLength(uint256 idsLength, uint256 valuesLength);\\n}\\n\",\"keccak256\":\"0x880da465c203cec76b10d72dbd87c80f387df4102274f23eea1f9c9b0918792b\",\"license\":\"MIT\"}},\"version\":1}","metadata":{"compiler":{"version":"0.8.30+commit.73712a01"},"language":"Solidity","output":{"abi":[{"inputs":[{"internalType":"address","name":"sender","type":"address"},{"internalType":"uint256","name":"balance","type":"uint256"},{"internalType":"uint256","name":"needed","type":"uint256"},{"internalType":"uint256","name":"tokenId","type":"uint256"}],"type":"error","name":"ERC1155InsufficientBalance"},{"inputs":[{"internalType":"address","name":"approver","type":"address"}],"type":"error","name":"ERC1155InvalidApprover"},{"inputs":[{"internalType":"uint256","name":"idsLength","type":"uint256"},{"internalType":"uint256","name":"valuesLength","type":"uint256"}],"type":"error","name":"ERC1155InvalidArrayLength"},{"inputs":[{"internalType":"address","name":"operator","type":"address"}],"type":"error","name":"ERC1155InvalidOperator"},{"inputs":[{"internalType":"address","name":"receiver","type":"address"}],"type":"error","name":"ERC1155InvalidReceiver"},{"inputs":[{"internalType":"address","name":"sender","type":"address"}],"type":"error","name":"ERC1155InvalidSender"},{"inputs":[{"internalType":"address","name":"operator","type":"address"},{"internalType":"address","name":"owner","type":"address"}],"type":"error","name":"ERC1155MissingApprovalForAll"}],"devdoc":{"kind":"dev","methods":{},"version":1},"userdoc":{"kind":"user","methods":{},"version":1}},"settings":{"remappings":["@openzeppelin/contracts/=lib/openzeppelin-contracts/contracts/","ds-test/=lib/openzeppelin-contracts/lib/forge-std/lib/ds-test/src/","erc4626-tests/=lib/openzeppelin-contracts/lib/erc4626-tests/","forge-std/=lib/forge-std/src/","halmos-cheatcodes/=lib/openzeppelin-contracts/lib/halmos-cheatcodes/src/","openzeppelin-contracts/=lib/openzeppelin-contracts/"],"optimizer":{"enabled":false,"runs":200},"metadata":{"useLiteralContent":true,"bytecodeHash":"ipfs"},"compilationTarget":{"lib/openzeppelin-contracts/contracts/interfaces/draft-IERC6093.sol":"IERC1155Errors"},"evmVersion":"prague","libraries":{}},"sources":{"lib/openzeppelin-contracts/contracts/interfaces/draft-IERC6093.sol":{"keccak256":"0x880da465c203cec76b10d72dbd87c80f387df4102274f23eea1f9c9b0918792b","urls":[],"content":"// SPDX-License-Identifier: MIT\n// OpenZeppelin Contracts (last updated v5.1.0) (interfaces/draft-IERC6093.sol)\npragma solidity ^0.8.20;\n\n/**\n * @dev Standard ERC-20 Errors\n * Interface of the https://eips.ethereum.org/EIPS/eip-6093[ERC-6093] custom errors for ERC-20 tokens.\n */\ninterface IERC20Errors {\n    /**\n     * @dev Indicates an error related to the current `balance` of a `sender`. Used in transfers.\n     * @param sender Address whose tokens are being transferred.\n     * @param balance Current balance for the interacting account.\n     * @param needed Minimum amount required to perform a transfer.\n     */\n    error ERC20InsufficientBalance(address sender, uint256 balance, uint256 needed);\n\n    /**\n     * @dev Indicates a failure with the token `sender`. Used in transfers.\n     * @param sender Address whose tokens are being transferred.\n     */\n    error ERC20InvalidSender(address sender);\n\n    /**\n     * @dev Indicates a failure with the token `receiver`. Used in transfers.\n     * @param receiver Address to which tokens are being transferred.\n     */\n    error ERC20InvalidReceiver(address receiver);\n\n    /**\n     * @dev Indicates a failure with the `spender`’s `allowance`. Used in transfers.\n     * @param spender Address that may be allowed to operate on tokens without being their owner.\n     * @param allowance Amount of tokens a `spender` is allowed to operate with.\n     * @param needed Minimum amount required to perform a transfer.\n     */\n    error ERC20InsufficientAllowance(address spender, uint256 allowance, uint256 needed);\n\n    /**\n     * @dev Indicates a failure with the `approver` of a token to be approved. Used in approvals.\n     * @param approver Address initiating an approval operation.\n     */\n    error ERC20InvalidApprover(address approver);\n\n    /**\n     * @dev Indicates a failure with the `spender` to be approved. Used in approvals.\n     * @param spender Address that may be allowed to operate on tokens without being their owner.\n     */\n    error ERC20InvalidSpender(address spender);\n}\n\n/**\n * @dev Standard ERC-721 Errors\n * Interface of the https://eips.ethereum.org/EIPS/eip-6093[ERC-6093] custom errors for ERC-721 tokens.\n */\ninterface IERC721Errors {\n    /**\n     * @dev Indicates that an address can't be an owner. For example, `address(0)` is a forbidden owner in ERC-20.\n     * Used in balance queries.\n     * @param owner Address of the current owner of a token.\n     */\n    error ERC721InvalidOwner(address owner);\n\n    /**\n     * @dev Indicates a `tokenId` whose `owner` is the zero address.\n     * @param tokenId Identifier number of a token.\n     */\n    error ERC721NonexistentToken(uint256 tokenId);\n\n    /**\n     * @dev Indicates an error related to the ownership over a particular token. Used in transfers.\n     * @param sender Address whose tokens are being transferred.\n     * @param tokenId Identifier number of a token.\n     * @param owner Address of the current owner of a token.\n     */\n    error ERC721IncorrectOwner(address sender, uint256 tokenId, address owner);\n\n    /**\n     * @dev Indicates a failure with the token `sender`. Used in transfers.\n     * @param sender Address whose tokens are being transferred.\n     */\n    error ERC721InvalidSender(address sender);\n\n    /**\n     * @dev Indicates a failure with the token `receiver`. Used in transfers.\n     * @param receiver Address to which tokens are being transferred.\n     */\n    error ERC721InvalidReceiver(address receiver);\n\n    /**\n     * @dev Indicates a failure with the `operator`’s approval. Used in transfers.\n     * @param operator Address that may be allowed to operate on tokens without being their owner.\n     * @param tokenId Identifier number of a token.\n     */\n    error ERC721InsufficientApproval(address operator, uint256 tokenId);\n\n    /**\n     * @dev Indicates a failure with the `approver` of a token to be approved. Used in approvals.\n     * @param approver Address initiating an approval operation.\n     */\n    error ERC721InvalidApprover(address approver);\n\n    /**\n     * @dev Indicates a failure with the `operator` to be approved. Used in approvals.\n     * @param operator Address that may be allowed to operate on tokens without being their owner.\n     */\n    error ERC721InvalidOperator(address operator);\n}\n\n/**\n * @dev Standard ERC-1155 Errors\n * Interface of the https://eips.ethereum.org/EIPS/eip-6093[ERC-6093] custom errors for ERC-1155 tokens.\n */\ninterface IERC1155Errors {\n    /**\n     * @dev Indicates an error related to the current `balance` of a `sender`. Used in transfers.\n     * @param sender Address whose tokens are being transferred.\n     * @param balance Current balance for the interacting account.\n     * @param needed Minimum amount required to perform a transfer.\n     * @param tokenId Identifier number of a token.\n     */\n    error ERC1155InsufficientBalance(address sender, uint256 balance, uint256 needed, uint256 tokenId);\n\n    /**\n     * @dev Indicates a failure with the token `sender`. Used in transfers.\n     * @param sender Address whose tokens are being transferred.\n     */\n    error ERC1155InvalidSender(address sender);\n\n    /**\n     * @dev Indicates a failure with the token `receiver`. Used in transfers.\n     * @param receiver Address to which tokens are being transferred.\n     */\n    error ERC1155InvalidReceiver(address receiver);\n\n    /**\n     * @dev Indicates a failure with the `operator`’s approval. Used in transfers.\n     * @param operator Address that may be allowed to operate on tokens without being their owner.\n     * @param owner Address of the current owner of a token.\n     */\n    error ERC1155MissingApprovalForAll(address operator, address owner);\n\n    /**\n     * @dev Indicates a failure with the `approver` of a token to be approved. Used in approvals.\n     * @param approver Address initiating an approval operation.\n     */\n    error ERC1155InvalidApprover(address approver);\n\n    /**\n     * @dev Indicates a failure with the `operator` to be approved. Used in approvals.\n     * @param operator Address that may be allowed to operate on tokens without being their owner.\n     */\n    error ERC1155InvalidOperator(address operator);\n\n    /**\n     * @dev Indicates an array length mismatch between ids and values in a safeBatchTransferFrom operation.\n     * Used in batch transfers.\n     * @param idsLength Length of the array of token identifiers\n     * @param valuesLength Length of the array of token amounts\n     */\n    error ERC1155InvalidArrayLength(uint256 idsLength, uint256 valuesLength);\n}\n","license":"MIT"}},"version":1},"id":24}